{
  "unit_id": "short-text",
  "unit_name_jp": "短い情報文・広告",
  "grade": "英語リーディング（共通テスト第1問相当）",
  "patterns": [
    {
      "pattern_id": "info-scan-basic",
      "description": "広告・イベント案内・お知らせ文から、設問で指定された特定情報（日時・場所・料金・連絡先など）を素早くスキャンして取り出す",
      "thinking_process": [
        "設問を先に読み、何の情報を探すのかを明確にする",
        "本文の中で該当しそうな箇所（数字・固有名詞・曜日など）に目を走らせる",
        "見つけた情報と設問の条件を照合して正しい選択肢を選ぶ"
      ],
      "common_mistakes": [
        "設問を先に読まず本文を頭から全部読んでしまい、時間を使いすぎる",
        "似た数字（料金と時間、日付と定員数など）を読み間違える",
        "本文に複数の情報があるとき、設問に関係ない情報を選んでしまう"
      ],
      "difficulty": "basic"
    },
    {
      "pattern_id": "illustration-caption-basic",
      "description": "挿絵・図・写真に付いた説明文（キャプション）を読み、各選択肢が本文の内容と一致するかを照合する",
      "thinking_process": [
        "選択肢に目を通し、どんな違いが問われているかを把握する",
        "本文の各文を読みながら、選択肢の記述が正しいかどうかを一つずつ確認する",
        "全文と一致する選択肢を1つに絞る（部分的に正しいだけの選択肢を除外する）"
      ],
      "common_mistakes": [
        "本文の一部とだけ一致する選択肢を「正しい」と判断してしまう",
        "本文に書かれていない内容を自分の知識で補って選んでしまう",
        "否定語（not, never, no）を読み飛ばして逆の解釈をしてしまう"
      ],
      "difficulty": "basic"
    },
    {
      "pattern_id": "website-multi-condition",
      "description": "イベント詳細・サービス紹介のウェブページから、複数の条件（対象者・日程・料金・申込方法など）をすべて照合して正しい情報を選ぶ",
      "thinking_process": [
        "設問が求める条件を整理する（例：料金と日程の両方を確認する必要があるか）",
        "本文の各セクション（見出しや箇条書き）を目安に必要な情報の場所を特定する",
        "各選択肢について、すべての条件が本文と一致するか確かめる"
      ],
      "common_mistakes": [
        "複数の条件のうち1つだけ確認して正解だと思い込む",
        "「一般料金」と「割引料金」など複数の料金設定がある場合に取り違える",
        "本文の異なるセクションに分散した情報を統合しないまま解答する"
      ],
      "difficulty": "standard"
    },
    {
      "pattern_id": "eligibility-condition",
      "description": "参加資格・利用条件（年齢・居住地・会員資格・購入条件など）が本文に複数示されており、どの条件を満たすかを正確に読み取って判断する",
      "thinking_process": [
        "本文の条件をすべてリストアップし、各選択肢の状況と照合する",
        "「～を除く」「～のみ」「ただし～」といった例外・限定表現に注意する",
        "条件をすべて満たす選択肢（または満たさない選択肢）を1つ特定する"
      ],
      "common_mistakes": [
        "例外条件（ただし～・～を除く）を見落として、一般条件だけで判断する",
        "and（すべての条件を満たす）とor（どれか1つでよい）を混同する",
        "条件の対象が「人」か「商品・サービス」かを取り違える"
      ],
      "difficulty": "standard"
    },
    {
      "pattern_id": "not-mentioned",
      "description": "「本文に述べられていないもの」「本文の内容に当てはまらないもの」を選ぶ設問で、各選択肢について本文の根拠を探し、記述がない選択肢を特定する",
      "thinking_process": [
        "選択肢を1つずつ取り上げ、それに対応する記述が本文にあるかを検索する",
        "本文に根拠が見つかった選択肢を消去法で外していく",
        "最後に残った「本文に根拠がない」選択肢が正解となる"
      ],
      "common_mistakes": [
        "「書いてなくても常識的に正しいだろう」と自分の知識で判断して誤る",
        "本文中の似た表現を見つけて「書いてある」と判断するが、内容が微妙に異なる",
        "NOT問題と気づかず「当てはまるもの」を選んでしまう"
      ],
      "difficulty": "exam"
    },
    {
      "pattern_id": "purpose-intent",
      "description": "広告・案内文・お知らせ全体の目的（なぜ書かれたか）または書き手の意図（何を伝えたいか）を問う設問で、細部ではなく文書全体のメッセージを読み取る",
      "thinking_process": [
        "文書のタイトル・冒頭・末尾（結論・行動喚起）に注目して全体の目的を把握する",
        "各選択肢が文書全体のトーンや内容と合っているかを確認する",
        "細部の一情報しか反映していない選択肢と、全体の目的を表す選択肢を区別する"
      ],
      "common_mistakes": [
        "文書の一部の情報だけに注目し、全体の目的を読み間違える",
        "具体的な詳細（料金・日程など）を答えてしまい、「目的」の問いに答えていない",
        "2つの選択肢が似ているとき、より具体的すぎる方を選んでしまう"
      ],
      "difficulty": "exam"
    }
  ]
}
