{
  "unit_id": "graph-and-table",
  "unit_name_jp": "図表付き文章読解",
  "grade": "英語リーディング（共通テスト第4問レベル）",
  "patterns": [
    {
      "pattern_id": "gt-basic-table-read",
      "description": "表・グラフの特定の数値（最大値・最小値・特定項目の値）を直接読み取る",
      "thinking_process": [
        "問題文で何を問われているか（最大・最小・特定値）を確認する",
        "表の該当行・列を探す",
        "値を正確に読み取り、選択肢と照合する"
      ],
      "common_mistakes": [
        "行と列を混同して誤った値を読んでしまう",
        "最大値と最小値を混同する",
        "単位（%・人数など）を確認せず数値だけで判断する"
      ],
      "difficulty": "basic"
    },
    {
      "pattern_id": "gt-basic-comparison",
      "description": "表の複数の値を比較して最大・最小・特定の順位を判断する",
      "thinking_process": [
        "比較する列または行を特定する",
        "各項目の値をすべて確認する",
        "大小関係を整理し、問いの条件（最大・最小・〇番目）に合うものを選ぶ"
      ],
      "common_mistakes": [
        "一部の値だけを見て判断してしまい、すべてを確認しない",
        "表の読み方（行見出しと列見出し）を間違える"
      ],
      "difficulty": "basic"
    },
    {
      "pattern_id": "gt-basic-single-value",
      "description": "本文で言及された特定の項目について、表から正確な値を読み取る",
      "thinking_process": [
        "本文で問われている項目名を確認する",
        "表の中でその項目を探す",
        "対応する値を正確に読み取って選択肢と照合する"
      ],
      "common_mistakes": [
        "似た名前の別項目の値を読んでしまう",
        "本文の記述を先に信じてしまい、表を確認しない"
      ],
      "difficulty": "basic"
    },
    {
      "pattern_id": "gt-standard-text-table-match",
      "description": "本文の記述内容と表の数値を照合して、両方と一致する説明を選ぶ",
      "thinking_process": [
        "本文の主な主張・記述（増加・減少・最大・最小・比較）を整理する",
        "表から該当する数値を読み取る",
        "各選択肢について、本文の記述と表の数値の両方と一致するか確認する",
        "3つが不一致であることを確認してから正解を決める"
      ],
      "common_mistakes": [
        "本文のみ・表のみと照合して判断し、両方の照合を忘れる",
        "選択肢が本文の一部とは一致しているが、表の数値と矛盾しているものを選んでしまう",
        "増加・減少の方向を誤って読む（from→to の順序を間違える）"
      ],
      "difficulty": "standard"
    },
    {
      "pattern_id": "gt-standard-condition",
      "description": "本文で提示された条件（〇〇以上かつ△△以下など）を表に当てはめ、条件を満たす項目を特定する",
      "thinking_process": [
        "本文から条件（複数ある場合もある）を正確に読み取る",
        "表の各行について、条件を一つずつ確認する",
        "すべての条件を満たす行だけが正解になる"
      ],
      "common_mistakes": [
        "複数条件のうち1つだけを確認して判断してしまう",
        "「以上」と「超える」、「以下」と「未満」を混同する"
      ],
      "difficulty": "standard"
    },
    {
      "pattern_id": "gt-standard-trend",
      "description": "本文が説明する傾向（増加・減少・相関など）が表の数値と一致するかを確認する",
      "thinking_process": [
        "本文が述べている傾向（例：〇〇ほど△△が大きい）を整理する",
        "表の数値が実際にその傾向を示しているかを確認する",
        "選択肢の中で本文の傾向説明と表のデータが両方とも正しいものを選ぶ"
      ],
      "common_mistakes": [
        "傾向の方向（増加vs減少）を逆に解釈する",
        "一部のデータだけを確認して全体の傾向を判断してしまう"
      ],
      "difficulty": "standard"
    },
    {
      "pattern_id": "gt-exam-not",
      "description": "本文と表のどちらかまたは両方と矛盾する選択肢（NOT問題）を選ぶ",
      "thinking_process": [
        "問いが「一致しないもの」を問うNOT問題であることを確認する",
        "各選択肢について、本文の記述を確認し、次に表の数値を確認する",
        "本文・表と矛盾する選択肢を特定する",
        "残り3つが本文・表と一致することを確認してから答える"
      ],
      "common_mistakes": [
        "選択肢が「ありそうな内容」だという印象で正しいと思い込む",
        "NOT問題と気づかずに一致するものを選んでしまう",
        "1つ見つけたらすぐに答えを決め、他の選択肢の検証を省略する"
      ],
      "difficulty": "exam"
    },
    {
      "pattern_id": "gt-exam-integration",
      "description": "本文と表の情報を統合して、より高次の結論・解釈・タイトルを選ぶ",
      "thinking_process": [
        "本文全体の主旨と表全体のデータを把握する",
        "各選択肢が本文と表の両方から支持されるかを確認する",
        "一部にしか当てはまらない選択肢、データから導けない選択肢を除外する",
        "本文の主旨と表のデータの両方を最もよく反映する選択肢を選ぶ"
      ],
      "common_mistakes": [
        "表のデータからは読み取れない結論を「常識」で選んでしまう",
        "本文に書かれていない情報を選択肢に加えた解釈を選んでしまう",
        "部分的にしか正しくない選択肢を全体を説明していると誤解する"
      ],
      "difficulty": "exam"
    }
  ]
}
