{
  "unit_id": "opinion-essay",
  "unit_name_jp": "意見文・メール読解",
  "grade": "中学英語（中1〜中3・高校受験レベル）",
  "patterns": [
    {
      "pattern_id": "oe-basic-1",
      "description": "意見文・メールに明示された事実（日時・人物・行動・数量）を本文から取り出す",
      "thinking_process": [
        "設問が何の情報（いつ・どこ・誰・何を・いくつ）を問うているか確認する",
        "英文から該当する情報を含む箇所を探す",
        "4択と本文の情報を照合し、一致する選択肢を選ぶ"
      ],
      "common_mistakes": [
        "本文に書かれていない内容を常識や推測で選んでしまう",
        "似た単語が含まれる選択肢を本文の内容と混同する"
      ],
      "difficulty": "basic"
    },
    {
      "pattern_id": "oe-basic-2",
      "description": "メール・意見文の送り手が述べている主な内容（お願い・報告・提案）を確認する",
      "thinking_process": [
        "誰が誰に何の目的で書いているかを最初に確認する",
        "本文全体を読んで主な内容（依頼・報告・提案）を把握する",
        "設問に合う選択肢を選ぶ"
      ],
      "common_mistakes": [
        "メールの一部だけ読んで全体の目的を誤解する",
        "具体的な内容と全体の目的を混同する"
      ],
      "difficulty": "basic"
    },
    {
      "pattern_id": "oe-basic-3",
      "description": "意見文に書かれている筆者の行動・習慣・経験を本文から確認する",
      "thinking_process": [
        "設問が「筆者が何をしているか・していたか」を問うていると認識する",
        "英文から筆者の行動・経験を示す動詞句を探す",
        "4択と照合して正しい選択肢を選ぶ"
      ],
      "common_mistakes": [
        "筆者の行動と、筆者が引用した他者の行動を混同する",
        "現在の習慣と過去の経験を取り違える"
      ],
      "difficulty": "basic"
    },
    {
      "pattern_id": "oe-standard-1",
      "description": "筆者の主張（意見）と、その主張を支える根拠・理由を区別して読む",
      "thinking_process": [
        "筆者が「〜すべき」「〜は大切だ」などの主張をしている箇所を特定する",
        "その主張の理由として「because / since / for example」で導かれる内容を探す",
        "選択肢の中から「筆者の主張の根拠として使われている内容」を選ぶ"
      ],
      "common_mistakes": [
        "主張そのものと根拠を混同する",
        "筆者が反論として紹介している意見（筆者自身の考えでない内容）を根拠と誤解する"
      ],
      "difficulty": "standard"
    },
    {
      "pattern_id": "oe-standard-2",
      "description": "事実の記述と意見・感想の表現を区別する",
      "thinking_process": [
        "事実とは客観的に確認できること（数値・出来事・場所など）",
        "意見とは「I think」「I believe」「should」「important」など主観的な表現が伴うもの",
        "各選択肢が本文中で「事実として」書かれているか「意見として」書かれているかを区別する"
      ],
      "common_mistakes": [
        "数値が含まれていても「〜すべきだ」は意見であることに気づかない",
        "「I think」がなくても文脈上明らかに意見であるものを事実と誤解する"
      ],
      "difficulty": "standard"
    },
    {
      "pattern_id": "oe-standard-3",
      "description": "意見文の構成（主張→根拠→まとめ）を把握して、設問に対応する箇所を特定する",
      "thinking_process": [
        "意見文の冒頭・中盤・末尾でそれぞれ何が述べられているかを整理する",
        "設問が「主張」「根拠」「まとめ」のどれを問うているかを判断する",
        "対応する本文箇所と選択肢を照合する"
      ],
      "common_mistakes": [
        "冒頭の問題提起を筆者の主張だと誤解する",
        "結論部分（まとめ）と本文中の根拠を区別できない"
      ],
      "difficulty": "standard"
    },
    {
      "pattern_id": "oe-exam-1",
      "description": "意見文全体を通じて筆者が最も伝えたいことを把握する",
      "thinking_process": [
        "意見文の主張・根拠・結論の流れ全体を確認する",
        "繰り返し登場するキーワード・テーマを把握する",
        "4択の中から「意見文全体の主旨」に最も近い選択肢を選ぶ"
      ],
      "common_mistakes": [
        "一部の具体例だけに注目してしまい全体のメッセージを見落とす",
        "筆者が反論として紹介した内容を筆者の主張だと誤解する"
      ],
      "difficulty": "exam"
    },
    {
      "pattern_id": "oe-exam-2",
      "description": "NOT問題：意見文に書かれていないことを選ぶ",
      "thinking_process": [
        "設問が「本文に書かれていないこと」を問うていると認識する",
        "各選択肢に対応する本文箇所を探す",
        "本文に根拠が見当たらない選択肢を消去法で特定する"
      ],
      "common_mistakes": [
        "「ありそう」「常識的に正しい」という判断で選んでしまう",
        "NOT問題と気づかずに「本文に書かれているもの」を選んでしまう"
      ],
      "difficulty": "exam"
    },
    {
      "pattern_id": "oe-exam-3",
      "description": "意見文のタイトルとして最も適切なものを選ぶ",
      "thinking_process": [
        "意見文のテーマ・主張・結論を整理する",
        "タイトルは「意見文全体を表す」ものでなければならないことを意識する",
        "4択の各タイトルが意見文全体に合うか・一部にしか合わないかを判定する"
      ],
      "common_mistakes": [
        "意見文の細部（1つの例）だけを表すタイトルを選んでしまう",
        "英語のタイトル選択では単語の意味だけで判断し、意見文全体との対応を確認しない"
      ],
      "difficulty": "exam"
    }
  ]
}
