{
  "unit_id": "narrative",
  "unit_name_jp": "物語・日記文読解",
  "grade": "中学英語（中1〜中3・高校受験レベル）",
  "patterns": [
    {
      "pattern_id": "narrative-basic-1",
      "description": "登場人物の行動・出来事を本文から探す（内容一致）",
      "thinking_process": [
        "設問が「誰が何をしたか」「いつどこで何があったか」を問うていると認識する",
        "英文から該当する情報（固有名詞・動詞・時間・場所）を探す",
        "4択と本文の情報を1つずつ照合し、一致する選択肢を選ぶ"
      ],
      "common_mistakes": [
        "本文に書かれていない情報を選んでしまう（思い込みで答える）",
        "似た単語を含む選択肢を本文と混同する"
      ],
      "difficulty": "basic"
    },
    {
      "pattern_id": "narrative-basic-2",
      "description": "登場人物が感じた気持ちや状況を本文の具体的な描写から読み取る",
      "thinking_process": [
        "設問で問われている場面・時点を特定する",
        "その場面での登場人物の行動・発言・状況描写を本文から見つける",
        "描写から気持ち・状況を推測し、選択肢と照合する"
      ],
      "common_mistakes": [
        "登場人物の気持ちを自分の感覚で選んでしまう（根拠を本文に求めない）",
        "話の前後の文脈を無視して1文だけで判断する"
      ],
      "difficulty": "basic"
    },
    {
      "pattern_id": "narrative-standard-1",
      "description": "出来事の因果関係・理由を読み取る",
      "thinking_process": [
        "設問が「なぜ〜したか」「〜した理由」を問うていると認識する",
        "本文中の because / so / that's why などの接続表現や文脈から原因・結果を把握する",
        "日本語の選択肢と英文の内容を対応させて正答を選ぶ"
      ],
      "common_mistakes": [
        "because の前後を逆に解釈する（原因と結果を取り違える）",
        "理由が複数文にまたがっているとき、1文だけ読んで判断する"
      ],
      "difficulty": "standard"
    },
    {
      "pattern_id": "narrative-standard-2",
      "description": "登場人物の心情変化を時系列に沿って読み取る",
      "thinking_process": [
        "物語の流れを前・中・後の3段階に整理する",
        "各段階での登場人物の気持ちを示す表現（形容詞・動詞・発言）を探す",
        "どのような出来事がきっかけで気持ちが変化したかを把握し、選択肢と照合する"
      ],
      "common_mistakes": [
        "話の最初の気持ちと最後の気持ちを混同する",
        "変化のきっかけとなる出来事を見落とす"
      ],
      "difficulty": "standard"
    },
    {
      "pattern_id": "narrative-standard-3",
      "description": "物語の内容に合う・合わないを選ぶ（内容一致・不一致の判断）",
      "thinking_process": [
        "各選択肢が述べている内容を確認する",
        "それぞれの選択肢と対応する本文箇所を探す",
        "本文と一致するか・しないかを1つずつ判定する"
      ],
      "common_mistakes": [
        "all / always / never などの強い言葉を含む選択肢を安易に正しいと判断する",
        "本文に似た単語があるだけで一致と判断する"
      ],
      "difficulty": "standard"
    },
    {
      "pattern_id": "narrative-exam-1",
      "description": "書き手（登場人物）が最も伝えたいことや物語のメッセージを読み取る",
      "thinking_process": [
        "物語全体の流れ・結末・結論部分の表現を確認する",
        "繰り返し登場するキーワード・テーマを把握する",
        "4択の中から「物語全体を通じて最も伝えたいこと」に最も近い選択肢を選ぶ"
      ],
      "common_mistakes": [
        "物語の一部（冒頭・中間）だけで選んでしまう（全体を俯瞰しない）",
        "一番長い・難しい選択肢を選んでしまう（内容を確認しない）"
      ],
      "difficulty": "exam"
    },
    {
      "pattern_id": "narrative-exam-2",
      "description": "NOT問題：本文で述べられていないことを選ぶ",
      "thinking_process": [
        "設問が「本文に書かれていないこと」を問うていると認識する",
        "各選択肢に対応する本文箇所を探す",
        "本文に根拠がない選択肢を1つ特定して選ぶ（消去法を活用する）"
      ],
      "common_mistakes": [
        "「ありそう」「常識的に正しい」で選んでしまう（本文に根拠を求めない）",
        "NOT問題と気づかず、「本文と一致するもの」を選んでしまう"
      ],
      "difficulty": "exam"
    },
    {
      "pattern_id": "narrative-exam-3",
      "description": "物語のタイトルとして最も適切なものを選ぶ",
      "thinking_process": [
        "物語の中心的なテーマ・出来事・登場人物の変化を整理する",
        "タイトルには「物語全体を表す」ものが適切であることを意識する",
        "4択の各タイトルが物語全体に合うか・一部にしか合わないかを判定する"
      ],
      "common_mistakes": [
        "物語の細部（1つのエピソード）だけを表すタイトルを選んでしまう",
        "英語のタイトル選択問題では単語の意味だけで判断し、物語との対応を確認しない"
      ],
      "difficulty": "exam"
    }
  ]
}
