{
  "unit_id": "linear-equations",
  "unit_name_jp": "一次方程式",
  "grade": "中学1年",
  "patterns": [
    {
      "pattern_id": "one-step-equations",
      "description": "1ステップで解ける方程式（+・-・×・÷の逆演算）",
      "thinking_process": [
        "等式の両辺に同じ操作をしても等号が成り立つことを確認する",
        "x を孤立させるために逆演算（+なら-、×なら÷）を施す",
        "解を元の式に代入して確認する"
      ],
      "common_mistakes": [
        "x+3=7 で x=7+3=10 とする（逆演算でなく同じ演算をする）",
        "2x=8 で x=8×2=16 とする（÷でなく×をする）",
        "解の代入確認を省いて符号ミスに気づかない"
      ],
      "difficulty": "basic"
    },
    {
      "pattern_id": "multi-step-equations",
      "description": "移項を使って解く方程式（文字と数を左右に分ける）",
      "thinking_process": [
        "文字項を左辺、数項を右辺に移項する",
        "移項すると符号が変わることを確認する",
        "係数で両辺を割って x を求める"
      ],
      "common_mistakes": [
        "移項しても符号を変えないミス（3x-5=1 → 3x=1-5 とする）",
        "左辺の文字項と右辺の文字項をまとめるときに符号を誤る",
        "最後に係数で割るのを忘れて係数ごと答えにしてしまう"
      ],
      "difficulty": "basic"
    },
    {
      "pattern_id": "equations-with-parentheses",
      "description": "かっこを含む方程式（分配法則→移項→計算）",
      "thinking_process": [
        "分配法則でかっこを展開する",
        "同類項をまとめてから移項する",
        "係数で割って解を求め、代入確認する"
      ],
      "common_mistakes": [
        "分配法則でかっこ内の第2項に係数をかけ忘れる",
        "かっこの前が負の数のとき展開後の符号を誤る（-（2x-3）→-2x-3 とする）",
        "展開前に移項しようとして計算が複雑になる"
      ],
      "difficulty": "standard"
    },
    {
      "pattern_id": "equations-with-fractions",
      "description": "係数に分数・小数を含む方程式（両辺に最小公倍数や10のべき乗をかける）",
      "thinking_process": [
        "分数係数は両辺に分母の最小公倍数をかけて整数に直す",
        "小数係数は両辺に10・100などをかけて整数に直す",
        "整数方程式として移項・計算する"
      ],
      "common_mistakes": [
        "分数の方程式で分子だけにかけて分母を残してしまう",
        "最小公倍数を一部の項だけにかける",
        "0.3x=0.9 を 3x=9 に直すつもりで 3x=0.9 としてしまう"
      ],
      "difficulty": "standard"
    },
    {
      "pattern_id": "equation-word-problems",
      "description": "文章題で方程式を立てて解く（数量関係を等式で表す）",
      "thinking_process": [
        "求めたいものを x とおく",
        "等しい数量関係（合計・差・2倍など）を見つけて等式を立てる",
        "方程式を解き、答えが問題の条件を満たすか確認する"
      ],
      "common_mistakes": [
        "x とおくものを間違える（個数なのに代金を x とする）",
        "「a より b 多い」を a-b=x と逆に立式する",
        "解が得られても単位・条件（整数か、正か）の確認をしない"
      ],
      "difficulty": "exam"
    },
    {
      "pattern_id": "ratio-equations",
      "description": "比の方程式・比例式（a:b=c:d → ad=bc）",
      "thinking_process": [
        "比例式 a:b=c:d は ad=bc の関係を使う",
        "内項の積＝外項の積で方程式を作る",
        "方程式を解いて解を確認する"
      ],
      "common_mistakes": [
        "内項・外項を逆にかけてしまう",
        "比例式を分数の等式に変換するときに分子分母を逆にする",
        "比の問題で「全体」と「部分」の関係を混同する"
      ],
      "difficulty": "exam"
    }
  ]
}
