{
  "unit_id": "short-text",
  "unit_name_jp": "短文読解",
  "grade": "中学1〜3年生（高校受験レベル）",
  "patterns": [
    {
      "pattern_id": "basic-specific-info-time-place",
      "description": "案内文・掲示・メールなどの短い英文（50〜100語）から、時間・場所・日付などの具体的な情報を探し出す",
      "thinking_process": [
        "英文全体をざっと読んで何の文章かを把握する（案内文・掲示・メールなど）",
        "設問で問われている情報（いつ・どこで・誰が）を確認する",
        "英文中から該当する情報（数字・固有名詞・場所名）を探す",
        "4つの選択肢と本文の情報を照らし合わせて正しいものを選ぶ"
      ],
      "common_mistakes": [
        "設問の問いと別の情報（例：日付を聞かれているのに場所を選ぶ）を選んでしまう",
        "本文中の数字や名前を誤読する（例：3:00 p.m.を午前3時と読む）",
        "本文には書かれていない情報を「そうだろう」と推測して選んでしまう"
      ],
      "difficulty": "basic"
    },
    {
      "pattern_id": "basic-person-action",
      "description": "日記・メール・短い物語の英文から、誰が何をしたかという行動・事実を探す",
      "thinking_process": [
        "英文の主語（誰が）に注目しながら読む",
        "設問で問われている人物や行動を確認する",
        "本文中で該当する人物が何をしたかを探す",
        "選択肢の内容と本文の記述を照らし合わせる"
      ],
      "common_mistakes": [
        "複数の人物が登場するとき、主語を取り違える",
        "時制（過去・現在）を無視して行動を読み取る",
        "否定文（did not / never）を肯定の意味で読み取ってしまう"
      ],
      "difficulty": "basic"
    },
    {
      "pattern_id": "basic-notice-poster",
      "description": "お知らせ・ポスター・プログラムの英文から必要な情報（料金・参加条件・場所など）を読み取る",
      "thinking_process": [
        "お知らせ・ポスターの種類（イベント告知・学校行事・店舗情報など）を把握する",
        "設問で問われている具体的な条件・数字を確認する",
        "英文中のキーワード（Free, Ticket, Date, Open など）に注目して情報を探す",
        "選択肢と本文情報を照らし合わせる"
      ],
      "common_mistakes": [
        "複数の時間・日程が書かれているとき、違う方の情報を選ぶ",
        "条件（例：「12歳以下は無料」）を反対に読む",
        "単位（円・ドル・分・時間）を読み飛ばす"
      ],
      "difficulty": "basic"
    },
    {
      "pattern_id": "standard-main-idea",
      "description": "50〜120語の短文（メール・日記・案内文）の主旨・目的・筆者が最も伝えたいことを読み取る",
      "thinking_process": [
        "英文全体を読んで「何のために書かれた文章か」を考える",
        "繰り返し出てくるキーワードや話題の中心に注目する",
        "選択肢それぞれが本文の主旨と合っているか確認する",
        "細かい詳細ではなく「文章全体のメッセージ」を選ぶ"
      ],
      "common_mistakes": [
        "本文に書かれた細かい情報（一部の事実）を主旨と勘違いする",
        "本文に書かれていない内容を「そう言いたいのだろう」と推測して選ぶ",
        "最初の1文だけ読んで主旨を決めてしまう"
      ],
      "difficulty": "standard"
    },
    {
      "pattern_id": "standard-writer-intent",
      "description": "メール・案内文の「書いた目的」（依頼・招待・お礼・謝罪・情報提供など）を読み取る",
      "thinking_process": [
        "誰が誰に書いた文章かを把握する",
        "冒頭・末尾の文に注目し、文章の目的を考える（お願い・お知らせ・お礼など）",
        "選択肢の目的の言葉（to invite / to thank / to ask / to explain）と本文を照らし合わせる",
        "最も適切な目的を選ぶ"
      ],
      "common_mistakes": [
        "本文に含まれる別の行動を目的と混同する（例：本文でお礼を述べながら依頼するメールで「お礼」を選ぶ）",
        "書いた目的（why）と内容（what）を混同する",
        "動詞（invite / ask / explain）の意味を正確に知らず選ぶ"
      ],
      "difficulty": "standard"
    },
    {
      "pattern_id": "standard-inference",
      "description": "短文の流れから書かれていないことを推測する問題（筆者の気持ち・次の行動・理由の推測）",
      "thinking_process": [
        "本文に直接書かれていない情報を問う問題だと認識する",
        "本文に書かれた事実（行動・発言・状況）を整理する",
        "整理した事実から「合理的に導ける結論」を考える",
        "本文に根拠がある推測を選ぶ（根拠がない推測は不正解）"
      ],
      "common_mistakes": [
        "本文に全く根拠がない想像で選ぶ",
        "自分の常識や経験で「こうなるはず」と思い込む",
        "本文に書かれた事実そのもの（推測でない）を推測問題の答えに選ぶ"
      ],
      "difficulty": "standard"
    },
    {
      "pattern_id": "exam-not-question",
      "description": "「本文の内容と合わないものはどれか（NOT問題）」を選ぶ問題。4選択肢のうち3つは本文に書かれていて、1つは本文と違う・または本文に書かれていない",
      "thinking_process": [
        "NOT問題だと認識し、「合わない」ものを探すことを意識する",
        "選択肢を1つずつ本文と照らし合わせる",
        "本文の内容と一致する選択肢に×をつけながら確認する",
        "本文と一致しない（または本文に記述がない）残りの選択肢を選ぶ"
      ],
      "common_mistakes": [
        "「合うもの」を選んでしまう（問いを読み違える）",
        "3つ確認したところで残りを確認せずに答えを決める",
        "本文に似た表現があると「合っている」と判断してしまう（表現が違うだけで意味は同じ場合も）"
      ],
      "difficulty": "exam"
    },
    {
      "pattern_id": "exam-multiple-info",
      "description": "複数の情報（2〜3の条件・事実）を組み合わせて答えを導く問題",
      "thinking_process": [
        "設問が何を組み合わせて答えるよう求めているかを確認する",
        "本文から関係する複数の情報を探す",
        "複数の情報を組み合わせて論理的に正しい選択肢を導く",
        "すべての条件を満たす選択肢のみが正解になることを確認する"
      ],
      "common_mistakes": [
        "複数の条件のうち1つだけ確認して残りを見落とす",
        "本文の別々の箇所に書かれた情報をつなぎ合わせることを忘れる",
        "一部の条件に合う選択肢を早まって選ぶ"
      ],
      "difficulty": "exam"
    },
    {
      "pattern_id": "exam-paraphrase",
      "description": "本文の表現が言い換えられた選択肢を選ぶ問題（同じ内容を別の英語・日本語で表す）",
      "thinking_process": [
        "選択肢の日本語（または英語）が本文のどの部分に対応するかを考える",
        "本文の表現を別の言葉で言い換えると何になるかを考える",
        "意味が同じかどうかを確認する（表現が違っても内容が同じなら正解）",
        "意味が少し違う選択肢との差に注意する"
      ],
      "common_mistakes": [
        "本文と同じ単語が使われている選択肢を正解と思い込む（ただし意味がずれている場合がある）",
        "言い換えられた表現の意味の微妙な差を見落とす",
        "全体の文脈を無視して一部の語句だけで判断する"
      ],
      "difficulty": "exam"
    }
  ]
}
